{
  "ContractVersion": "1.0",
  "MissionName": "CUSTOMER_MASTER_WRAPPED",
  "QualifierSource": "C:\\DLE-OS\\Repositories\\DLE-OS\\Tools\\CustomerMaster\\VPro\\CUSTOMER_MASTER_QUALIFIER.src",
  "RequiredIdentity": "DLE-OS-HOST\\DLE-OS",
  "RequireNonElevated": true,
  "RequiredMappedPaths": ["X:\\"],
  "RequiredSourcePaths": [
    "X:\\AON\\ADATA\\ARM-01", "X:\\AON\\ADATA\\ARM-02",
    "X:\\AON\\ADATA\\ARM-03", "X:\\AON\\ADATA\\ARM-05",
    "X:\\AON\\ADATA\\ARM-06", "X:\\AON\\ADATA\\ARM-09",
    "X:\\AON\\ADATA\\ARM-10", "X:\\AON\\ADATA\\ARM-14"
  ],
  "AttemptRoot": "C:\\Add-On\\Lab\\VProQualificationHarness\\CustomerMaster",
  "VariableEffectiveLength": 16,
  "SourceReplacements": {
    "__RUN_ID__": "{ATTEMPT_ID}",
    "__LAB_RUNTIME__": "{RUNTIME}"
  },
  "Retry": { "MaximumAutomaticRetries": 1, "RetryableCategories": ["RUNTIME_EXIT"] },
  "Compiler": {
    "Executable": "C:\\BASIS\\VPRO5\\pro5cpl.exe",
    "Arguments": ["-d{PROGRAMS}", "{SOURCE}"],
    "EmittedArtifactName": "CUSTOMER_MASTER_QUALIFIER.src",
    "ExpectedArtifactName": "CUSTOMER_MASTER_QUALIFIER",
    "MinimumArtifactBytes": 32,
    "FailurePatterns": ["(?i)\\berror\\b", "(?i)\\bfatal\\b"],
    "KnownStaleHashes": []
  },
  "Runtime": {
    "Executable": "C:\\BASIS\\VPRO5\\vpro5.exe",
    "Arguments": ["-tT0", "-nT0", "-m1024", "-c{CONFIG}", "CUSTOMER_MASTER_QUALIFIER"],
    "ConfigurationLines": [
      "ALIASES=4", "FCBS=64", "CIBS=64", "STBLEN=12000",
      "PREFIX {PROGRAMS_POSIX}/ C:/BASIS/VPRO5/",
      "SETOPTS 0000000000000000", "ALIAS T0 SYSWINDOW \"\""
    ],
    "Directories": ["Pass1", "Pass2"],
    "AdapterType": "MARKER_FILES",
    "StartedMarker": "SOURCE_PASS_SUMMARY.csv",
    "ProgressMarker": "SOURCE_PASS_SUMMARY.csv",
    "ProgressPattern": "*",
    "CompletionMarker": "RUNTIME_VERDICT.txt",
    "CompletionSuccessPattern": "(?im)^qualification_verdict=PASS\\s*$",
    "FirstMarkerTimeoutSeconds": 30,
    "RequireProgress": true,
    "ProgressTimeoutSeconds": 120,
    "HardRuntimeTimeoutSeconds": 900,
    "GracefulCloseTimeoutSeconds": 10
  }
}
