{
  "ContractVersion": "1.0",
  "MissionName": "VPRO_HARNESS_LIVE_ACCEPTANCE",
  "QualifierSource": "C:\\DLE-OS\\Repositories\\DLE-OS\\Tools\\VProQualificationHarness\\VPro\\HARNESS_ARM09_BOUNDED_ACCEPTANCE.src",
  "RequiredIdentity": "DLE-OS-HOST\\DLE-OS",
  "RequireNonElevated": true,
  "RequiredMappedPaths": ["X:\\"],
  "RequiredSourcePaths": ["X:\\AON\\ADATA\\ARM-09"],
  "AttemptRoot": "C:\\Add-On\\Lab\\VProQualificationHarness\\LiveAcceptance",
  "VariableEffectiveLength": 16,
  "SourceReplacements": {
    "__HARNESS_RUNTIME__": "{RUNTIME}"
  },
  "Retry": { "MaximumAutomaticRetries": 0, "RetryableCategories": [] },
  "Compiler": {
    "Executable": "C:\\BASIS\\VPRO5\\pro5cpl.exe",
    "Arguments": ["-d{PROGRAMS}", "{SOURCE}"],
    "EmittedArtifactName": "HARNESS_ARM09_BOUNDED_ACCEPTANCE.src",
    "ExpectedArtifactName": "HARNESS_ARM09_BOUNDED_ACCEPTANCE",
    "MinimumArtifactBytes": 32,
    "FailurePatterns": ["(?i)\\berror\\b", "(?i)\\bfatal\\b"],
    "KnownStaleHashes": []
  },
  "Runtime": {
    "Executable": "C:\\BASIS\\VPRO5\\vpro5.exe",
    "Arguments": ["-tT0", "-nT0", "-m1024", "-c{CONFIG}", "HARNESS_ARM09_BOUNDED_ACCEPTANCE"],
    "ConfigurationLines": [
      "ALIASES=4", "FCBS=64", "CIBS=64", "STBLEN=12000",
      "PREFIX {PROGRAMS_POSIX}/ C:/BASIS/VPRO5/",
      "SETOPTS 0000000000000000", "ALIAS T0 SYSWINDOW \"\""
    ],
    "AdapterType": "MARKER_FILES",
    "StartedMarker": "STARTED.marker",
    "ProgressMarker": "PROGRESS.marker",
    "CompletionMarker": "COMPLETE.marker",
    "FirstMarkerTimeoutSeconds": 30,
    "RequireProgress": true,
    "ProgressTimeoutSeconds": 30,
    "HardRuntimeTimeoutSeconds": 90,
    "GracefulCloseTimeoutSeconds": 10
  }
}
