{
  "ContractVersion": "1.0",
  "MissionName": "PURCHASE_ORDER_PLATFORM_001",
  "QualifierSource": "C:\\DLE-OS\\Repositories\\DLE-OS\\Tools\\PurchaseOrder\\VPro\\PURCHASE_ORDER_QUALIFIER.src",
  "RequiredIdentity": "DLE-OS-HOST\\DLE-OS",
  "RequireNonElevated": true,
  "RequiredMappedPaths": ["X:\\"],
  "RequiredSourcePaths": [
    "X:\\AON\\ADATA\\POE-02",
    "X:\\AON\\ADATA\\POE-12",
    "X:\\AON\\ADATA\\POE-04",
    "X:\\AON\\ADATA\\POE-14",
    "X:\\AON\\ADATA\\POT-04",
    "X:\\AON\\ADATA\\POT-14"
  ],
  "AttemptRoot": "C:\\Add-On\\Lab\\VProQualificationHarness\\PurchaseOrder",
  "VariableEffectiveLength": 16,
  "SourceReplacements": {
    "__RUN_ID__": "{ATTEMPT_ID}",
    "__LAB_RUNTIME__": "{RUNTIME}"
  },
  "Retry": {
    "MaximumAutomaticRetries": 1,
    "RetryableCategories": ["RUNTIME_EXIT"]
  },
  "Compiler": {
    "Executable": "C:\\BASIS\\VPRO5\\pro5cpl.exe",
    "Arguments": ["-d{PROGRAMS}", "{SOURCE}"],
    "EmittedArtifactName": "PURCHASE_ORDER_QUALIFIER.src",
    "ExpectedArtifactName": "PURCHASE_ORDER_QUALIFIER",
    "MinimumArtifactBytes": 32,
    "FailurePatterns": ["(?i)\\berror\\b", "(?i)\\bfatal\\b"],
    "KnownStaleHashes": []
  },
  "Runtime": {
    "Executable": "C:\\BASIS\\VPRO5\\vpro5.exe",
    "Arguments": [
      "-tT0", "-nT0", "-m1024", "-c{CONFIG}",
      "PURCHASE_ORDER_QUALIFIER"
    ],
    "ConfigurationLines": [
      "ALIASES=4", "FCBS=64", "CIBS=64", "STBLEN=12000",
      "PREFIX {PROGRAMS_POSIX}/ C:/BASIS/VPRO5/",
      "SETOPTS 0000000000000000", "ALIAS T0 SYSWINDOW \"\""
    ],
    "Directories": ["Pass1", "Pass2"],
    "AdapterType": "MARKER_FILES",
    "StartedMarker": "SOURCE_PASS_SUMMARY.csv",
    "ProgressMarker": "SOURCE_PASS_SUMMARY.csv",
    "ProgressPattern": "*",
    "CompletionMarker": "RUNTIME_VERDICT.txt",
    "CompletionSuccessPattern": "(?im)^qualification_verdict=PASS\\s*$",
    "FirstMarkerTimeoutSeconds": 30,
    "RequireProgress": true,
    "ProgressTimeoutSeconds": 900,
    "HardRuntimeTimeoutSeconds": 2400,
    "GracefulCloseTimeoutSeconds": 10
  }
}
